{
  "schema_version": "1.0",
  "class": "app.core.agent_loop.AgentLoop",
  "constructor_bypasses": [
    "app.core.agent_loop.GeneralSkillRunner",
    "app.core.agent_loop.KnowledgeService",
    "app.core.agent_loop.LLMClient"
  ],
  "graph_methods": [
    "_skill_steps",
    "_skill_nodes",
    "_ordered_skill_nodes",
    "_graph_outgoing_edges",
    "_next_steps_from_graph",
    "_default_next_step",
    "_graph_pending_steps",
    "_store_graph_pending_steps",
    "_queue_graph_sibling_steps",
    "_activate_next_pending_graph_step",
    "_is_terminal_skill_position",
    "_is_answer_ready_skill_state",
    "_graph_flow_has_unfinished_work"
  ],
  "call_topologies_to_characterize": [
    ["_skill_steps", "_ordered_skill_nodes", "_graph_outgoing_edges"],
    ["_queue_graph_sibling_steps", "_graph_outgoing_edges", "_edge_condition"],
    ["_activate_next_pending_graph_step", "_graph_pending_steps", "_store_graph_pending_steps"],
    ["_should_complete_skill", "_is_answer_ready_skill_state", "_is_terminal_skill_state"]
  ]
}
